{
  "$schema": "https://json-schema.org/draft/2020-12/schema",
  "title": "Expense",
  "description": "A submitted business expense submitted by a consultant for review and approval by finance.",
  "type": "object",
  "required": [
    "id",
    "submitterId",
    "description",
    "type",
    "amount",
    "currency",
    "receiptDate",
    "status",
    "submittedAt",
    "region",
    "project"
  ],
  "properties": {
    "id": {
      "type": "string",
      "format": "uuid",
      "description": "Unique identifier for the expense."
    },
    "submitterId": {
      "type": "string",
      "description": "User ID of the consultant who submitted the expense."
    },
    "description": {
      "type": "string",
      "description": "Human-readable description of the expense."
    },
    "type": {
      "type": "string",
      "enum": ["Breakfast", "Lunch", "Dinner", "Transport", "Accommodation"],
      "description": "Expense category recognized by policy."
    },
    "amount": {
      "type": "number",
      "exclusiveMinimum": 0,
      "description": "Monetary amount. Must be greater than 0."
    },
    "currency": {
      "type": "string",
      "pattern": "^[A-Z]{3}$",
      "description": "ISO 4217 currency code (e.g., GBP, EUR, USD)."
    },
    "receiptDate": {
      "type": "string",
      "format": "date",
      "description": "ISO 8601 date when the receipt was issued (YYYY-MM-DD)."
    },
    "status": {
      "type": "string",
      "enum": ["Submitted", "Approved", "Changes Requested", "Resubmitted"],
      "description": "Current workflow status of the expense."
    },
    "submittedAt": {
      "type": "string",
      "format": "date-time",
      "description": "ISO 8601 timestamp when the expense was first submitted."
    },
    "internalNotes": {
      "type": ["string", "null"],
      "default": null,
      "description": "Finance-only notes, typically populated when status is Changes Requested."
    },
    "region": {
      "type": "string",
      "description": "Geographic region or office (e.g., EMEA, DACH, Nordics)."
    },
    "project": {
      "type": "string",
      "description": "Associated project or client code/name."
    }
  },
  "additionalProperties": false
}
