[
  {
    "id": "e1a2b3c4-d5e6-4f7a-8b9c-d1e2f3a4b5",
    "submitterId": "u1",
    "description": "Client lunch meeting at Restaurant Noma",
    "type": "Lunch",
    "amount": 185.50,
    "currency": "DKK",
    "receiptDate": "2025-07-15",
    "status": "Approved",
    "submittedAt": "2025-07-16T09:30:00Z",
    "internalNotes": null,
    "region": "Nordics",
    "project": "Greenfield ERP"
  },
  {
    "id": "e2b3c4d5-e6f7-4a8b-9c0d-e2f3a4b5c6d7",
    "submitterId": "u1",
    "description": "Taxi to Copenhagen airport for client visit",
    "type": "Transport",
    "amount": 420,
    "currency": "DKK",
    "receiptDate": "2025-07-18",
    "status": "Submitted",
    "submittedAt": "2025-07-19T08:15:00Z",
    "internalNotes": null,
    "region": "Nordics",
    "project": "Greenfield ERP"
  },
  {
    "id": "e3c4d5e6-f7a8-4b9c-8d1e-f3a4b5c6d7e8",
    "submitterId": "u3",
    "description": "Hotel stay during Berlin conference",
    "type": "Accommodation",
    "amount": 320,
    "currency": "EUR",
    "receiptDate": "2025-07-10",
    "status": "Approved",
    "submittedAt": "2025-07-11T14:00:00Z",
    "internalNotes": null,
    "region": "DACH",
    "project": "Siemens Digital"
  },
  {
    "id": "e4d5e6f7-a8b9-4c0d-9e2f-a4b5c6d7e8f9",
    "submitterId": "u1",
    "description": "Working breakfast with stakeholders",
    "type": "Breakfast",
    "amount": 45,
    "currency": "EUR",
    "receiptDate": "2025-07-20",
    "status": "Changes Requested",
    "submittedAt": "2025-07-21T07:45:00Z",
    "internalNotes": "Receipt missing VAT breakdown. Please resubmit with itemized receipt showing VAT.",
    "region": "EMEA",
    "project": "Oracle Cloud Migration"
  },
  {
    "id": "e5e6f7a8-b9c0-4d1e-8f3a-b5c6d7e8f9a0",
    "submitterId": "u3",
    "description": "Team dinner at client premises in London",
    "type": "Dinner",
    "amount": 156.75,
    "currency": "GBP",
    "receiptDate": "2025-07-12",
    "status": "Submitted",
    "submittedAt": "2025-07-13T19:30:00Z",
    "internalNotes": null,
    "region": "EMEA",
    "project": "Barclays Fintech"
  },
  {
    "id": "e6f7a8b9-c0d1-4e2f-9a4b-c6d7e8f9a0b1",
    "submitterId": "u1",
    "description": "Train ticket Copenhagen to Malmö",
    "type": "Transport",
    "amount": 289,
    "currency": "DKK",
    "receiptDate": "2025-07-22",
    "status": "Resubmitted",
    "submittedAt": "2025-07-23T10:00:00Z",
    "internalNotes": null,
    "region": "Nordics",
    "project": "Greenfield ERP"
  },
  {
    "id": "e7a8b9c0-d1e2-4f3a-8b5c-d7e8f9a0b1c2",
    "submitterId": "u3",
    "description": "Business lunch with potential client in Frankfurt",
    "type": "Lunch",
    "amount": 95,
    "currency": "EUR",
    "receiptDate": "2025-07-25",
    "status": "Changes Requested",
    "submittedAt": "2025-07-26T12:00:00Z",
    "internalNotes": "Amount per person exceeds policy limit of 60 EUR. Please provide business justification.",
    "region": "DACH",
    "project": "Siemens Digital"
  },
  {
    "id": "e8b9c0d1-e2f3-4a4b-9c6d-e8f9a0b1c2d3",
    "submitterId": "u1",
    "description": "Uber from office to client site in Amsterdam",
    "type": "Transport",
    "amount": 35.50,
    "currency": "EUR",
    "receiptDate": "2025-07-28",
    "status": "Submitted",
    "submittedAt": "2025-07-28T16:45:00Z",
    "internalNotes": null,
    "region": "EMEA",
    "project": "Oracle Cloud Migration"
  },
  {
    "id": "e9c0d1e2-f3a4-4b5c-8d7e-f9a0b1c2d3e4",
    "submitterId": "u3",
    "description": "Airport parking for London trip",
    "type": "Transport",
    "amount": 48,
    "currency": "USD",
    "receiptDate": "2025-07-05",
    "status": "Approved",
    "submittedAt": "2025-07-06T08:00:00Z",
    "internalNotes": null,
    "region": "EMEA",
    "project": "Barclays Fintech"
  },
  {
    "id": "e0d1e2f3-a4b5-4c6d-9e8f-a0b1c2d3e4f5",
    "submitterId": "u1",
    "description": "Coffee and pastries for morning standup",
    "type": "Breakfast",
    "amount": 28.90,
    "currency": "EUR",
    "receiptDate": "2025-07-30",
    "status": "Resubmitted",
    "submittedAt": "2025-07-30T08:30:00Z",
    "internalNotes": null,
    "region": "DACH",
    "project": "Siemens Digital"
  }
]
